label,Quotes
KLOBUCHAR,"[' We need to work with our allies to work with Turkey and bring them out. This is an outrageous thing that happened here, and I think we need to talk about this not only in terms of the horror of what happened here with Turkey, but the fact that our president blew it, and now he’s too proud to say it, and what do we do now? We continue that humanitarian aid, but then we work with our allies to say, “Come back, Turkey, and stop this.” Because what Mayor Pete has just said is true. Think about our other allies, Israel. How do they feel right now? Donald Trump is not true to his word when they are a beacon of democracy in the Mid-East. Think about our allies in Europe when he pulls out of the Iranian agreement, and leaves them holding the bag, and gives the power to China and Russia.']"
YANG,"[' Well, first, we have to designate white supremacist terrorism as domestic terrorism so that the Department of Justice can properly measure it.']"
YANG,"[' Well, first, I just want to stick up for Tom. We have a broken campaign finance system, but Tom has been spending his own money fighting climate change. And you can’t knock someone for having money and spending it in the right way, my opinion.']"
YANG,"[' That’s exactly right, and we have to recognize this is a disease of capitalism run amok. There was a point when there were more opiate prescriptions in the state of Ohio than human beings in the state of Ohio. And for some reason the federal government thought that was appropriate. They ended up levying a $600 million fine against Purdue Pharma, which sounds like a lot of money until you realize that company made $30 billion. They got a 2% fine and they killed tens of thousands of Americans, eight an hour.']"
WARREN,"[' We live in a country now where the president is advancing environmental racism, economic racism, criminal justice racism, health care racism. The way we do better is to fight back and show something better. So I have a plan, for example, on education, that says we have to build a better education system for all our kids, but we’ve got to acknowledge what’s happened on race. So my plan has universal, tuition-free college for all of our kids, but also increases the Pell Grants and levels the playing field by putting $50 billion into historically black colleges and universities.']"
OROURKE,"[' I’ve listened to the sciences on this and they’re very clear. We don’t have more than 10 years to get this right. And we won’t meet that challenge with half steps or half measures or only half the country. We’ve gotta bring everyone in. The people of Detroit and those that I listened to in Flint last week, they want the challenge, they want those jobs, they wanna create the future for this country and the world. Those community college students that I met in Tucumcari, New Mexico understand that wind and solar jobs are the fastest growing jobs in the country. And those farmers in Iowa say, “Pay me for the environmental services of planting cover crops and keeping more land in conservation easements.” That’s how we meet the challenge. We do it with everyone in this country. We bring everyone into the solution.']"
BOOKER,"["" So background checks and gun licensing, these are agreed to by overwhelmingly the majority of Americans, 83% of Americans agree with licensing. This is the issue. Look, I grew up in the suburbs. It was about 20 years ago that I came out of my home when I moved to inner city Newark, New Jersey, and witnessed the aftermath of a shooting. It’s one of the reasons why shooting after shooting after shooting in neighborhoods like mine for decades, this has been a crisis for me. It’s why I was the first person to come out for gun licensing. And I’m happy that people like Beto O'Rourke are showing such courage now and coming forward and also now supporting licensing. But this is what I’m sorry about. I’m sorry that it had to take issues coming to my neighborhood or personally affecting Beto to suddenly make us demand change. This is a crisis of empathy in our nation. We are never going to solve this crisis if we have to wait for it to personally affect us or our neighborhood or our community before we demand action.""]"
BOOKER,"[' The only people, though, who actually buy into this president’s hateful rhetoric around immigrants are people who don’t know any. We have an opportunity to build an American majority around immigration reform. In my community, a group of conservative Republicans rallied around an individual, a beloved, local individual who was deported when he went in to ICE to try to get his paperwork sorted out, because they never thought it would happen to him. In some of the most conservative rural areas of Iowa, I have seen communities that embraced immigration grow, and it’s why part of my plan for revitalizing the economies of rural America, includes Community Renewal Visas that would allow cities and towns and counties that are hurting… Not only for jobs, but for population, to embrace immigration, as we have in my city.']"
WARREN,"[' Now, I wanna have a chance to tell the story about my friend Eddie Barkin. Eddie is 35 years old, he has a wife, Rachel. He has a cute little boy named Carl. He also has ALS and it’s killing him. Eddie has health insurance, good health insurance…']"
WARREN,"[' Now, that didn’t happen, and look what happened as a result. Donald Trump broke the law again in the summer, broke it again this fall. We took a constitutional oath and that is that no one is above the law, and that includes the President of the United States. Impeachment is the way that we establish that this man will not be permitted to break the law over and over without consequences. This is about Donald Trump, but understand', ' It’s about the next president, and the next president, and the next president and the future of this country.']"
OROURKE,"[' How else can we explain that we lose nearly 40,000 people in this country to gun violence, a number that no other country comes even close to, that we know what all the solutions are, and yet nothing has changed? It is because, in this country, money buys influence, access, and, increasingly, outcomes. The Centers for Disease Control prevented from actually studying the issue in the first place. As president, we will make sure that we ban political action committee contributions to any member of Congress or any candidate for federal office. We will listen to people, not PAnderson Coopers, people, not corporations, people, not special interests. It’s not…']"
WARREN,"[' So climate crisis is the existential crisis for our world. It puts every living thing on this planet at risk. I have a plan for a green industrial policy that takes advantage of the fact that we do what we do best, and that is innovate and create. So I’ve proposed putting $2 trillion in so we do the research. We then say, anyone in the world can use it so long as you build it right here in America. That will produce about 1.2 million manufacturing jobs right here in Michigan, right here in Ohio, right here in the industrial Midwest. And the second thing we will do is we will then sell those products all around the world. Right now, for every $1 the United States spends trying to market around the world, China’s spending $100.']"
YANG,"[' And the people in Washington DC had nothing for this. They don’t want to touch it, they don’t want to talk about an issue they don’t think they have a solution for. I’m not running for president because I’ve fantasized about being president, I’m running for president because like many of you here in this room tonight, I’m a parent and a patriot, and I have seen the future that we’re leaving for our kids, and it is not something I’m willing to accept. We need to create a new way forward for our people. If you want to join us in rewriting the rules of the 21st century economy, go to yang2020.com and make it so that we can look our kids in the eyes and say to them, and believe it, “Your country loves you, your country values you, and you will be alright.”']"
YANG,[' We should not be pushing everyone to leave the home and go to the workforce. Many parents see that trade-off and say if they leave the home and work they’re going to be spending all the money on child care anyway; in many cases it would be better if the parent stays home with the child.']
KLOBUCHAR,"[' Yes, I do. And I appreciate Elizabeth’s work. But again, the difference between a plan and a pipe dream is something that you can actually get done and we can get this public option done and we can take on the pharmaceutical companies and bring down the prices. But what really bothers me about this discussion, which we’ve had so many times, is that we don’t talk about the things that I’m hearing about from regular Americans, that is longterm care. We are seeing, I once called it a silver tsunami, the aging, and then someone told me that was too negative. So I call it the silver surge, the aging of the population. We need to make it easier to get longterm care insurance and strengthen Medicaid. In this state, the state of Ohio that has been hit by the opioid epidemic, we need to take on those pharma companies and make them pay for the addiction that they have caused and the people that they have killed.']"
BOOKER,"[' Absolutely, if this is not effective, we see people cutting holes in this wall, his wall, the way he brags about it is just wrong. We need to have policies that respect dignity, keep us safe and strong. I wanted to return back to this issue of Black voters. I have a lifetime of experience with Black voters; I’ve been one since I was 18.']"
BUTTIGIEG,"[' I’m talking about building up alliances, and if your question is about experience, let’s also talk about judgment. One of the foreign leaders you mentioned meeting was Bashar al-Assad. I have, in my experience, such as it is, whether you think it counts or not, since it wasn’t accumulated in Washington, enough judgment that I would not have sat down with a murderous dictator like that.']"
KLOBUCHAR,"[' This was much more serious than that. This was actually invading our election. So to protect ourself in 2020, what we need', ' One, back-up paper ballots in every single state. That is the bill that I need and we need to stop Mitch McConnell from stopping that from happening and then we need to stop the social media companies from running paid political ads, including ones last time in rubles without having to say where those ads came from and who paid for them. That’s the Honest Ads Act. That’s a bipartisan bill that I lead and we can’t wait to…']"
CASTRO,"[' Thanks a lot, Erin. And you see that everybody has their own plans. And let me just say that the way that I view this is born out of my own experience. I grew up, like I bet a lot of folks in this room grew up and folks that are watching on TV, I grew up with my twin brother Joaquin in a single-parent household where my mom was working hard to support us, and also her mom, my grandmother, and we knew what it was like to wonder whether we were going to be able to pay the rent at the first of the month. Or sometimes have the electricity turned off. And when I was a kid to look at the grocery lists that seemed to get shorter and shorter. And that’s what’s happening to a lot of families these days.']"
SANDERS,"[' Trump is a pathological liar. I tell the truth. We have been in Afghanistan, I think 18 years, in Iraq 16 or 17 years. We have spent $5 trillion on the war on terror, and there are probably more terrorists out there now than before it began. We’re gonna spend the Congress’s past and I will not vote for a $715 billion military budget, more than the 10 next countries combined. What we need is a foreign policy that focuses on diplomacy, ending conflicts like people sitting at a table, not by killing each other. As president of the United States, I will go to the United Nations and not denigrate it, not attack the UN, but bring countries together in the Middle East and all over the world, to come to terms with their differences and solve those problems peacefully. The United States cannot be the policemen of the world.']"
SANDERS,"[' Guess what? You’re guessing. Alright, and here’s the answer. We are the wealthiest country in the history of the world, and yet we have the highest child poverty rate of almost any country on earth. We have teachers in this country who are leaving education because they can’t work two or three jobs to support themselves, which is why under my legislation, we’ll move to see that every teacher in America makes at least $60,000 a year. What we will also do is not only have universal pre-K, we will make public colleges and universities and HBCUs debt-free. And what we will also do, because this is an incredible burden on millions and millions of young people who did nothing wrong, except try to get the education they need, we are going to cancel all student debt in this country.']"
GABBARD,"[' I’m glad you asked, because I was going to say it’s not fair to ask these three about their health and their fitness to serve as president but not every other one of us. I am grateful to have been trained very well by the army and do my best to stay in shape. But here’s the real question I believe you should be asking is', ' Who is fit to serve as our commander-in-chief? This is the most important responsibility that the president has. What Donald Trump has been doing in Syria and what we have just seen with him, inviting Turkey to come in and slaughter the Kurds, show what an unfit president looks like.']"
STEYER,"[' More than double. So for us to win, for everybody on this stage, for whoever is the candidate, to have a Senate that’s democratic, for us to have the sweeping victory that we absolutely…']"
BIDEN,"[' What Latinos should look at is, comparing this president to the president we have is outrageous. Number one, we didn’t lock people up in cages, we didn’t separate families, we didn’t do all of those things, number one. Number two, by the time… This is the president who came along with the DAnderson CooperA program. No one had ever done that before. This is the president who sent a legislation to desk, saying he wants to find a pathway for the 11 million undocumented in the United States of America. This is the president who has done a great deal. So I’m proud to have served with him.']"
CASTRO,"[' While I’m not categorically against charter schools, I would require more transparency and accountability from them than is required right now.']"
KLOBUCHAR,"[' That is incorrect. I just have a better way to do this. And in one of my first debates, Jake Tapper, I was called a street fighter from the Iron Range by my opponent, and when she said it, I said, “Thank you.” So this is what I think we need to get done. We need the public option. That’s what Barack Obama wanted. And it would bring health care costs down for everyone. And by the way, I just don’t buy this. I’ve heard some of these candidates say that it’s somehow not moral, if you… Not moral to not have that public option. Well Bernie Sanders was actually on a public option bill last year, and that was, Bernie, the Medicaid public option bill that Senator Schatz introduced. Clearly this is the easiest way to move forward quickly. And I wanna get things done. People can’t wait. I’ve got… My friend, Nicole, out there who’s son who has actually died trying to ration his insulin as a restaurant manager, and he died because he didn’t have enough money to pay for it.']"
CASTRO,"[' I grew up in one of those neighborhoods that folks have talked about. In a neighborhood that was grappling with the legacy of segregation. In fact, in two public school districts that were involved in a 1973 Supreme Court case challenging how Texas financed its schools. And I know that today our schools are segregated because our neighborhoods are segregated. Now, I have an education plan, like a lot of folks up here, that would pay teachers more, that would recruit diverse ranks of teachers, that would invest in our public schools, but I also believe that we have to connect the dots to uplift the quality of life, to invest in housing opportunity, to invest in job opportunity, to invest in community schools that offer resources like parents able to go back and get their GED, and healthcare opportunities, and those things that truly, truly ensure that the entire family can prosper. Those are the types of things that we need to do, in addition to lifting up our public schools. You asked a second ago about charter schools. Look, it is a myth that charter schools are better than public schools, they’re not and so…']"
BIDEN,"[' What I would do as president is several more things, because things have changed. I would, in fact, make sure that there is… We immediately surge to the border. All those people who are seeking asylum, they deserve to be heard, that’s who we are. We’re a nation that says, “If you want to flee and you’re fleeing oppression, you should come.” I would change the order that the President just changed saying, “Women who were being beaten and abused could no longer claim that as a reason for asylum.” And, by the way, retrospectively, the 25th anniversary of the Violence Against Women Act is up. The Republican Congress has not reauthorized it. Let’s put pressure on them to pass the Violence Against Women Act now for them to go back.']"
GABBARD,"[' Yeah, absolutely. So really what you’re saying, Mayor Pete, is that you would continue to support having US troops in Syria for an indefinite period of time to continue this regime change war that has caused so many refugees to flee Syria, that you would continue to have our country involved in a war that has undermined our national security, you would continue this policy of the US actually providing arms and support to terrorist groups in Syria like Al-Qaeda, HTom Steyer, al-Nusra, and others because they are the ones who have been the ground force in this regime change war. That’s really what you’re saying.']"
STEYER,"[' Well, I agree with exactly what Bernie said, but I want to talk about how we’re going to win in 2020. I don’t mean to change the subject, but I think it’s sort of important that the Democratic Party not only beat Donald Trump in 2020, but have a sweeping victory across the country. And what that’s going to mean is turnout. In the United States of America, the Democratic Party keeps talking about trying to persuade a few people who are Republicans to like us, when up to half the people don’t vote at all, because they think neither party tells the truth. “No one deals with my issues. The system is broken. Why would we vote?” But what we’ve found at NextGen America is that is the start of a conversation about why votes are so important. And if you look at 2018 and flipping the house, what really happened was democratic voting went up by three quarters; in the 38 congressional districts where NextGen America was turning out young people, the turnout went up by more than a 100%.']"
SANDERS,"[' Resilience, to me, means growing up in a rent-controlled apartment in Brooklyn, New York, the son of an immigrant who came to this country without a nickel in his pocket. Professional resilience means to me, George Stephanopoulos, running for US Senate in Vermont, getting 1% of the vote; running for Governor and getting 2% of the vote. Finally becoming mayor of Burlington, Vermont with 10-vote margin. What resilience means to me is that throughout my political career, I have taken on virtually every powerful special interest in this country, whether it is Wall Street, whether it is the insurance industry, whether it is the pharmaceutical industry, whose corruption and greed is killing people today, whether it is a military industrial complex or a prison industrial complex. And I feel confident that given a life-long record, I’ve taken on powerful special interests of standing up for the working families of this country, that I will be able to take on the greed and corruption of the corporate elite and create a government and an economy that work for all of us, not just the 1%.']"
SANDERS,"[' As somebody who grew up in a family that lived in a rent-controlled apartment in Brooklyn, New York, and lived paycheck to paycheck. I’m running for president, not just to defeat the most dangerous President in the history of this country. A guy who’s a racist, and a sexist, and a homophobe. I’m running to transform this country, and to stand with the working class of America, which for the last 45 years has been decimated. Two days ago I had a remarkable experience, which should tell you everything you need to know about what’s going on in America. I took 15 people with diabetes from Detroit, a few miles into Canada, and we bought insulin for one-tenth the price being charged by the crooks who run the pharmaceutical industry in America today. But it’s not just the price-fixing, and the corruption, and the greed of the pharmaceutical industry. It’s what’s going on in the fossil fuel industry, it’s what’s going on in Wall Street, it’s what’s going on with the prison industrial complex. We need a mass political movement. Please go to berniesanders.com, become one of our million volunteers. Stand up and take on the greed…']"
CASTRO,[' I just want to make sure that we’re lifting up those families who are working and need help through an expanded earned income tax credit.']
BUTTIGIEG,"[' Well, first of all, I want to remark that we’re in the city of Atlanta, a city where a great local leader, Maynard Jackson, helped create the Black middle class that Atlanta is known by, by ensuring that taxpayer dollars were spent in a way that reflected the need to expand opportunity to those who were excluded. And just as local leaders have shown great leadership, we need to use the powers of the presidency on challenges like this, expanding opportunity and expanding a sense of belonging to those who have been excluded in this country. I’m not only running to defeat Donald Trump, I am running to prepare for the day that begins when Donald Trump has left office, to launch the era that must come after Trump.']"
KLOBUCHAR,"[' I just keep thinking of how close we are to finally getting something done on this. I’m looking at the mayor of Dayton. I met one of the survivors from that shooting. Thirty seconds, nine people killed. The public is with us on this, in a big way. The majority of Trump voters want to see universal background checks right now. The majority of hunters want to see us move forward with gun safety legislation. There are three bills right now on Mitch McConnell’s desk, the background check bill. My bill to close the boyfriend loop holes so domestic abusers don’t get guns. The bill to make it easier for police to vet people before they get a gun. That’s what we should be focusing on, and I just don’t want to screw this up. When I’m president, I do want to bring in in an assault weapon ban. And I do want to put a limitation on magazine so what happened in Dayton, Ohio will never happen again, but let’s not mess this up with this fight.']"
KLOBUCHAR,"[' It could work. I am open to it. But I want to give a reality check here to Elizabeth because no one on this stage wants to protect billionaires, not even the billionaire wants to protect billionaires.']"
BOOKER,"[' Nobody on this stage should need a focus group to hear from African-American voters. Black voters are pissed off and they’re worried. They’re pissed off because the only time our issues seem to be really paid attention to by politicians is when people are looking for their vote. And they’re worried because the Democratic Party, we don’t want to see people miss this opportunity and lose because we are nominating someone that doesn’t… Isn’t trusted, doesn’t have authentic connection.']"
YANG,"[' And second, I would say the days of meddling in American elections are over and we will take any undermining of our democratic processes as an act of hostility and aggression. The American people would back me on this. We know that they have found an underbelly and they’ve been clawing at it, and it’s made it so that we can’t even trust our own democracy.']"
WARREN,"[' I don’t understand why anybody goes to all the trouble of running for President of the United States just to talk about what we really can’t do and shouldn’t fight for. I don’t get it. Our biggest problem in Washington is corruption. It is giant corporations that have taken our government and that are holding it by the throat, and we need to have the courage to fight back against that. And until we’re ready to do that, it’s just more of the same. Well, I’m ready to get in this fight, I’m ready to win this fight.']"
OROURKE,"[' I do, because in my administration after we have waived citizenship fees for Green Card holders, more than 9 million of our fellow Americans, freed dreamers from any fear of deportation and stopped criminally prosecuting families and children for seeking asylum and refuge. End for-profit detention in this country, and then assist those countries in Central America so that no family ever has to make that 2,000 mile journey. Then I expect that people who come here follow our laws and we reserve the right to criminally prosecute them if they do not.']"
