label,Quotes
HARRIS,"[' Five million assault weapons are on the streets of America today. During the course of this debate, eight people will die from gun violence. The leading cause of death of young black men in America is gun violence, more than the top other six reasons, totaled. This is a serious matter. I have personally hugged more mothers of homicide victims than I care to tell you. I have looked at more autopsy photographs than I care to tell you. I have attended more police officer funerals than I care to tell you. I’m done. And we need action. And Congress has had years to act and failed because they do not have the courage. When I’m elected, I’ll give them 100 days to pull their act together, put a bill on my desk for signature, and if they don’t, I will take executive action and put in place a comprehensive background check requirement, and ban the importation of assault weapons into our country, ’cause it is time to act.']"
HARRIS,"[' So what I am saying is that it seems to me that you would be able to join me in saying the rule has to apply to Twitter, the same way, it does to Facebook.']"
HARRIS,"[' Who has spent full time… Who has spent full time criticizing people on this stage as affiliated with the Democratic Party. When Donald Trump was elected, not even sworn in, buddied up to Steve Bannon to get a meeting with Donald Trump in the Trump Tower, fails to call a war criminal by what he is as a war criminal, and then spends full time during the course of this campaign, again, criticizing the Democratic Party. What we need on this stage in November is someone who has the ability to win, and by that, we need someone on that stage who has the ability to go toe to toe with Donald Trump and someone who has the ability to rebuild the Obama coalition and bring the party and the nation together. I believe I am that candidate.']"
WARREN,"[' So let’s be clear, whenever someone hears the term Medicare for all who want it, understand what that really means, it’s Medicare for all who can afford it, and that’s the problem we’ve got. Medicare for all is the gold standard, it is the way we get healthcare coverage for every single American, including the family whose child has been diagnosed with cancer, including the person who’s just gotten an Tom Steyer diagnosis, that’s how we make sure that everyone gets healthcare. We can pay for this, I’ve laid out the basic principles, costs are going to go up for the wealthy, they’re going to go up for big corporations, they will not go up for middle class families and I will not sign a bill into law if that raises their costs, because costs are what people care about. I’ve been studying this for the biggest part of my life, why people go bankrupt.']"
WARREN,"[' This morning. I announced this morning that I’m not going to take any money from big tech executives, from Wall Street executives, we’ve already agreed, Bernie and I, we’re not taking any money from big pharma executives. You can’t go behind closed doors and take the money of these executives and then turn around and expect that these are the people who are actually finally going to enforce the laws. We need campaign finance rules and practices…']"
HARRIS,"[' You asked earlier about China. It’s a complicated relationship. We have to hold China accountable. They steal our products, including our intellectual property. They dump substandard products into our economy. They need to be held accountable. We also need to partner with China on climate and the crisis that that presents. We need to partner with China on the issue of North Korea. I am on, and I think the only person on this stage, the Senate Intelligence Committee and the Senate Homeland Security Committee. We need a partner on the issue of North Korea. But the bottomline is this, Donald Trump in office on trade policy, he reminds me of that guy in the Wizard of Oz, when you pull back the curtain, it’s a really small dude.']"
BUTTIGIEG,"[' The problem isn’t the polls. The problem is the policy. And I don’t need lessons from you on courage, political or personal. Everyone on this stage is determined to get something done. Everyone on this stage recognizes, or at least I thought we did, that the problem is not other Democrats who don’t agree with your particular idea of how to handle this. The problem is the National Rifle Association and their enablers in Congress and we should be united in taking the fight to them.']"
BOOKER,"[' I’m so grateful, again, as a mayor who was a mayor during a recession, who was a mayor during a housing crisis, who started my career as a tenants’ rights lawyer, these are all good points. But we’re not talking about something that is going on all over America, which is gentrification, and low income families being moved further and further out, often compounding racial segregation. And so all of these things we need to put more federal dollars in it, but we’ve got to start empowering people. We use our tax code to move wealth up. The mortgage interest deduction. My plan is very simple. If you are a renter who pays more than a third of your income in rent, then you will get a refundable tax credit between the amount you’re paying and the area median rent. That empowers people in the same way we empower homeowners. And what that does is it actually slashes poverty, 10 million people out. And, by the way, for those people who are facing eviction, it is about time that the only people, when they show up in rentals court that have a lawyer it’s not the landlord, it is also low-income family struggling to stay in their home.']"
KLOBUCHAR,"[' And this president indicated early on what he was going to do and he’s done it. When he was running for office, he literally said women should go to jail, then he dialed it back and said doctors should go to jail, so no surprise that we’re seeing these kinds of laws in Georgia and Alabama where his allies are passing these bills, and what we have to remember is that the people are with us, and I predict this will be a big election… An issue in the general election, and I just can’t wait to stand across from Donald Trump and say this to him, “You know what, the people are with us.” Over 70% of the people support Roe v. Wade. Over 90% of the people support funding for Planned Parenthood and making sure that women can get the healthcare they need. He is off the track on this, and he will hear from the women of America and this is how we’re going to win this election.']"
BUTTIGIEG,"[' Well, the President clearly has no strategy. When I first got into this race, I remember President Trump scoffed and said he’d like to see me making a deal with Xi Jinping. I’d like to see him making a deal with Xi Jinping.']"
BOOKER,"[' First of all, I want to say no. Actually, I want to translate that into Spanish', ' No. Look, on, let’s just be clear, the factory farming going on that’s assaulting this corporate consolidation of the agriculture industry, one of the reasons why I have a bill to put a moratorium on this kind of corporate consolidation is because this factory farming is destroying and hurting our environment. And you see independent family farmers being pushed out of business because of the kind of incentives we are giving that don’t line up with our values. That’s what I’m calling for. But I want to switch because we don’t have a crowded debate stage. We were talking about Afghanistan and Iraq. It annoys me that we had a conversation about our troops overseas and we didn’t say one word about veterans in our country. We have a shameful reality in America that we send people off to war and they often come home with invisible wounds, hurts and harms. They’re disproportionately homeless. You hear stories about women waiting for months for gynecological care through the VA. It is very important that as we, as a country, understand that we are not going to solve every problem with this outrageous increased militarism, that we also make sure that we stand up for the people that stood for us. We end our national anthem with, Home of the brave. It’s about time we make this a better home for our bravest.']"
SANDERS,[' On the Medicare for all the hospitals will save substantial sums of money because they’re not gonna be spending a fortune doing billing and the other bureaucratic things that they have to do today.']
OROURKE,"[' I would, in my first term in office, agree that there is nothing about perpetuating this war already in its 18th year, that will make it any better. We’ve satisfied the reasons for our involvement in Afghanistan in the first place, and it’s time to bring those service members back home from Afghanistan, but also from Iraq, also from Yemen and Somalia and Libya and Syria. There’s no reason for us to be at war all over the world tonight. As president, I will end those wars and we will not start new wars. We will not send more US service members overseas, to sacrifice their lives and to take the lives of others in our name, we can resolve these challenges…']"
GABBARD,"[' This is an issue that impacts all of us as Americans and people all over the world. This is not a Democrat issue or a Republican issue, this is about the environmental threats that each and every one of us face, these are the kinds of conversations that we’re having in our town hall meetings and house parties in different parts of the country where we have Democrats, Republicans, Libertarians and Independents coming together saying, “Hey, we are all concerned about making sure that we have clean water to drink for our families, that we have clean air to breathe, that we’re able to raise our kids in a community that’s safe.” It is the hyper-partisanship in Washington, unfortunately, that has created this gridlock that has stood in the way of the kinds of progress that I would bring about, as president.']"
BIDEN,"[' This is reassuring in the fact that we’re all acknowledging that we have to reach across the aisle, get things done. No other way to get anything done in this country. The two people maybe would surprise you the most were… He’s been mentioned twice, but John McCain, John McCain worked for me when he worked in the Navy, and he was my… He was assigned to me to travel around the world. We became close friends, he became very close friends with my wife Jill, Visited our home. He was there with his children. And on his death bed he asked me to do his eulogy. John, I would say to John, “John, you didn’t see a war you never wanted to fight.” And he’d say, “You didn’t see a problem you never wanted to solve.” But he was a great man of principle. He was honorable, he was honorable. And one of the things that’s the reason why I’m running, we have to restore the soul of this country. That’s why I’m doing this. In fact, this president has ripped the soul out of this country, divided us in ways that are absolutely outrageous. A liar, he cheats, he does not do anything to promote people generally.']"
BIDEN,"[' And so we have to just change the culture, period, and keep punching at it and punching at it and punching at it. It will be a big… No, I really mean it. It’s a gigantic issue. And we have to make it clear from the top, from the president on down, that we will not tolerate it. We will not tolerate this culture.']"
STEYER,"[' And over 10 years ago, I saw that there was a terrible threat to the safety and health of every American in terms of the climate crisis and I’ve been fighting those companies with the help of the American people ever since, successfully. And that’s why I’m running for president because our government has failed, it’s been bought by corporations and it’s absolutely essential to return power to the people.']"
STEYER,"[' So I’m friends with a woman from Denmark, South Carolina, named Deanna Berry, who’s fighting for clean water and environmental justice in her community. She’s a different gender, she’s a different race, she’s from a different part of the country, but she reminds me of my parents in terms of her courage and her optimism and her honor. My mother was a school teacher in the New York public schools, and in the Brooklyn house of detention. My father was the first generation in his family to go to college. My grandfather was a plumber. He interrupted his law degree to go into the Navy in World War II, and he ended up prosecuting the Nazis at Nuremberg. And when I asked him what that experience meant, he said, “When you see something wrong in your society, you fight it from the first day, and every single day after.” And that’s why I started the Need to Impeach Movement two years ago because there was something terribly wrong at 1600 Pennsylvania Avenue.']"
BIDEN,"[' Yes. And by the way, it’s one of the reasons… The first thing I would do is make sure we pass the Violence Against Women Act reauthorization, which I wrote. In fact, I didn’t write the reauthorization. I wrote the original Act. The fact is that what happens now is that we, in fact, have to fundamentally change the culture, the culture of how women are treated. That’s why as Vice President… And when I asked the President, I could start the movement on the college campuses to say, “It’s on us.” It’s everyone’s responsibility. We do not spend nearly enough time dealing with… I was stunned when I did a virtual town meeting that told me 30,000 people were on the call, young people between 15 and 25, and found out I said, “What do you need… What do you need to make you safer on college campuses and on your schools?” You know what they said? “Get men involved, engage the rest of the community.” And that’s when we started this movement on the college campuses to fundamentally change the culture. No man has a right to raise a hand to a woman in anger, other than in self-defense, and that rarely ever occurs.']"
BUTTIGIEG,"[' So, we don’t have to stand up here speculating about whether the public option will be better than… Or a Medicare for All environment will be better than the corporate options. We can put it to the test. That’s the concept of my Medicare for All Who Want It proposal. That way, if people like me are right, that the public alternative is going to be not only more comprehensive, but more affordable than any of the corporate options around there, we’ll see Americans walk away from the corporate options into that Medicare option, and it will become Medicare for All without us having to kick anybody off…']"
BIDEN,"[' The greed and profiteering of those insurance companies. They are as much against my bill as they are anybody else. That were strongly against ObamaCare. They know it cost them, and it’s going to take away the right of people to choose, the 160 million people out there who’ve negotiated their health insurance and they want to keep it.']"
GABBARD,"[' These are wars that have cost us as American taxpayers trillions of dollars since 9/11 alone, dollars that have come out of our pockets, out of our hospitals, out of our schools, out of our infrastructure needs. As president, I will end this foreign policy, end these regime change wars, work to end this new cold war and arms race, and instead invest our hard-earned tax payer dollars actually into serving the needs of the American people right here at home.']"
OROURKE,"[' The question was about tarrifs, and they’re a huge mistake. They constitute the largest tax increase on the American consumer, hitting the middle class and the working poor especially hard. And farmers in Iowa and across the country are bearing the brunt of the consequences. When have we ever gone to war, including a trade war, without allies and friends and partners? As president, we will hold China accountable, but we will bring our allies and friends like the European Union to bear. And we’ll also negotiate trade deals that favor farmers and American workers and protect human rights and the environment and labor. Not just here in the United States but in the…']"
SANDERS,"[' And second of all, second of all, many of our union brothers and sisters… Nobody more pro-union than me up here… Are now paying high deductibles and co-payments and when we do Medicare for All instead of having the company putting money into health care, they can get decent wage increases, which they’re not getting today.']"
BOOKER,"[' I will lead an effort to make sure that we re-write our immigration laws in that way. Never cage another child, make sure that there is accountability and justice for the seven lives lost under our care and our custody, but also face the fact that Democrats and Republicans alike voted to build a wall that has produced thousands of deaths of people trying to cross to join family or to work a job, that we have been part of deporting people, hundreds of thousands, just in the Obama administration alone, who posed no threat to this country, breaking up their families. Democrats have to get off the back foot. We have to lead on this issue because we know it is right, legalize America, begin with those more than 1 million dreamers, make them US citizens right now, and this their true home country. And extend that to their parents, their sisters and their brothers, and ensure that we have a legal, safe, orderly system to come to this country and add to our greatness here.']"
KLOBUCHAR,"[' We need a new foreign policy in this country, and that means renewing our relationships with our allies, it means rejoining international agreements, and it means reasserting our American values. And so, when the president did not stand up the way he should have to that killing and that dismemberment of a journalist with an American newspaper, that sent a signal to all dictators across the country, across the world that that was okay, and that’s wrong. And I want to add a few things to what my colleagues have said. First of all, the question about Russia. When we look at international agreements, we must start negotiating back with Russia, which has been a horrible player on the international scene, but the president precipitously got out of the nuclear agreement with Russia, and we must start negotiating, even though they were cheating, for the good of this world. And we must also start the negotiations for the new START Treaty, and when it comes to China, we need someone that sees the long term like I do, just like the Chinese do, because we have a president that literally makes decisions based on his next tweet, and they are in it for the long game.']"
BUTTIGIEG,"[' We can and must do that, but that means transcending this framework that pits us against each other, that pits a single black mother of three against a displaced auto worker. ‘Cause when I come… Where I come from, a lot of times, that displaced auto worker is a single black mother of three. We’ve got to say that and bring people together.']"
BUTTIGIEG,"[' Well, Congressman, you just made it clear that you don’t know how this is actually going to take weapons off the streets. If you can develop the plan further, I think we can have a debate about it, but we can’t wait. People are dying in the streets right now. We can’t wait for universal background checks that we finally have a shot to actually get through. We can’t wait to ban the sale of new weapons and high-capacity magazines so we don’t wind up with millions more of these things on the street. We can’t wait for Red Flag laws or go in to disarm domestic abusers and prevent suicides, which are not being talked about nearly enough as a huge part of the gun violence epidemic in this country. We cannot wait for purity tests. We have to just get something done.']"
BOOKER,"[' And what I learned there is that you have to be an executive that can heal. In my city, we have racial divides, we have geographic divides that go from wealth to people that are struggling. The success of my city was ’cause we brought us all together and did things that other people said couldn’t be done. When I am president of the United States, my campaign from the very beginning has not changed. My charge is to see a nation right now which has so much common pain, to channel that back into a sense of common purpose. And I will do whatever it takes, bringing creativity to that office like has never been seen before.']"
HARRIS,"[' When I think about this issue, it really is through the lens of my baby nieces who are one-and-a-half and three-years old. When I look at what is going to be the world if we do nothing, when they turn 20, I am really scared. And when I’ve been in the United States Senate, for now, the last two-and-a-half-years, and I look at our counterparts, the Republicans in the United States Senate, they must be looking at their children, and then when they look at the mirror, I don’t know what they see, but it’s a lack of courage. And this is an issue that, yes, it represents an existential threat. It is also something we can do something about. This is a problem that was created by human behaviors, and we can change our behaviors in a way that saves our planet, I’ve seen it happen in California.']"
WARREN,"[' What I do have a problem with is that, if we’re going to talk seriously about breaking up big tech, then we should ask if people are taking money from the big tech executives. If we’re going to talk seriously about breaking up big drug companies, we should ask if people are financing their campaigns by taking money from big drug executives, if we are going to talk about Wall Street and having some serious regulation over Wall Street, we should ask if people are funding their campaigns by taking money from those executives. So long as that’s…']"
WARREN,"[' So my view on this and what I have committed to is costs will go down for hard-working middle class families. I will not embrace a plan like Medicare for all who can afford it, that will leave behind millions of people who cannot, and I will not embrace a plan that says people have great insurance right until you get the diagnosis and the insurance company says, “Sorry, we’re not covering your expensive cancer treatments, we’re not covering your expensive treatment for Tom Steyer, we’re not covering what you need.”']"
HARRIS,"[' Sure. And everybody, please visit my website, KamalaHarris.org, for the details on everything I talk about. Six months. So, part of how I believe we’re going to win this election is, it is going to be because we are focused on the future, we are focused on the challenges that are presented today, and not trying to bring back yesterday to solve tomorrow.']"
HARRIS,"[' My plan is as follows', ' For any state that passes a law that violates the Constitution, and in particular Roe v. Wade, our Department of Justice will review that law to determine if it is compliant with Roe v. Wade and the Constitution, and if it is not that law will not go into effect, that’s called pre-clearance, because the reality is that while we still have, as I said earlier, these state legislators who are outdated and out of touch, mostly men who are telling women what to do with their bodies, then there needs to be accountability and consequence. But I’ll go further, you may have seen, I questioned Brett Kavanaugh, when I was a member of the Senate Judiciary Committee and asked him, as a nominee to serve on the United States Supreme Court, could he think of any law that tells a man what to do with his body? And the answer was No. The reality of it is this is still a fundamental issue of justice for women in America. Women have been given the responsibility to perpetuate the human species. Our bodies were created to do that and it does not give any other person the right to tell a woman what to do with that body. It is her body, it is her right, it is her decision.']"
WARREN,"[' I have the biggest anti-corruption plan since Watergate. It involves ending lobbying as we know it, blocking the revolving door between industry and Washington, making everyone who runs for federal office put their tax returns online. We have to have the courage, not to make just individual changes, not to fight for little pieces. We want to make real progress on climate, then we have to start by attacking the corruption that gives the oil industry and other fossil fuel industries a stranglehold over this country.']"
HARRIS,"[' I am. And I will tell you, as a former prosecutor, I do think of this as being a matter of justice and accountability, because they are nothing more than some high-level dope dealers. They have been engaged…']"
HARRIS,"[' So, six months’ paid family leave is meant to and is designed to adjust to the reality of women’s lives today. The reality also is that women are not paid equal for equal work in America. We passed the Equal Pay Act in 1963 but fast forward to the year of our Lord 2019, and women are paid 80 cents on the dollar, Black women 61 cents, Native American women, 58 cents, Latinas 53 cents.']"
