label,Quotes
KLOBUCHAR,"[' I wanna make it easier for kids to go to college. And I think we do it by focusing our resources on the people that need it most. And my problem with some of these plans is they literally would pay for wealthy kids, for Wall Street kids to go to college. There’s no difference. It says, “Everyone is free.” I don’t think that makes sense. And I’m very concerned if we do things like that. The debt we’re gonna pass on to the next generation and the next generation. So what I would do about student loan debt, is that I would allow people to refinance it at a better rate. And I would make sure that we improve those student loan repayment programs for our teachers and expand them, so that you literally over five, 10 years, can get it paid for if you go into occupations where we don’t have enough workers. I think we need to mesh what we were just talking about with the economy, with our education policy.']"
BIDEN,"[' I’m the only one in this stage who has taken on the NRA and beat them. And beat them twice. We were able to get assault weapons off the streets, and not be able to be sold for 10 years. Recent studies show that mass violence went down when that occurred. The way to deal with those guns and those AR-15s and assault weapons that are on the street, are not on the street, that people own, is to do what we do in the National Firearms Act, as it relate to machine guns, you must register that weapon. You must register it. When you register it, the likelihood of it being used diminishes exponentially. I’m the only one that got it moved to make sure that we could not have a magazine that had more than 10 rounds in it. I’ve done this. I know how to get it done. If you really want to get it done, go after the gun manufacturers and take back the exemption they have of not being able to be sued. That will change.']"
BIDEN,"[' No, look. Demonizing wealthy… What I talked about is how you get things done, and the way to get things done is take a look at the tax code right now. The idea we have to start rewarding work, not just wealth. I would eliminate the capital gains tax, and I would raise the capital gains tax to the highest rate of 39.5%. I would double it, because guess what? Why in God’s name should someone who’s clipping coupons in the stock market make in fact, pay a lower tax rate than someone who in fact is, like I said, a school teacher and a firefighter. It’s ridiculous. And they pay a lower tax.']"
SANDERS,"[' Well, Detroit was mentioned, and I’m delighted that Detroit is rebounding, but let us understand Detroit was nearly destroyed because of awful trade policy which allowed corporations to throw workers in this community out on the street, as they moved to low wage countries. To win this election and to defeat Donald Trump, which by the way, in my view, it’s not gonna be easy, we need to have a campaign of energy and excitement and of vision. We need to bring millions of young people into the political process in a way that we have never seen, by and among other things.']"
SANDERS,"[' No. But what I would support absolutely is passing major legislation. The gun legislation that people here are talking about. Medicare for All. Climate change legislation that saves the planet. I will not wait for 60 votes to make that happen. And you could do it in a variety of ways. You could do that through budget reconciliation law. You have a vice president who will, in fact, tell the Senate what is appropriate and what is in order, and what is not. But I want to get back to a point that Elizabeth made. And then, in fact, in terms of gun issues, picking up on Cory and Beto and everybody else. What we are looking at is a corrupt political system. And that means, whether it is the drug companies or the insurance companies or the fossil fuel industry determining what’s happening in Washington or, in this case, you got an NRA, which has intimidated the President of the United States and the Republican leadership. I am proud… I am proud that year after year, I had an F rating from the NRA, and as president, I will not be intimidated by the NRA.']"
CASTRO,"[' I don’t think it is. I wouldn’t pack the court. I think the plan that Mayor Pete mentioned is an interesting one, but I actually believe if we were selecting from one of those things, that the smarter move might be to look at term limits, or having people cycle off from the appellate courts, so that you would have a replenishment of perspective. I would also make sure that I appoint, as President, people who respect the precedent of Roe v. Wade, that we codify Roe v. Wade, and that we do away with things like the Hyde Amendment, because you shouldn’t only be able to have reproductive freedom if you have money. We have to think about people who do not, people who are poor. And we have to concern ourselves not only with reproductive freedom, but also reproductive justice, and invest in the ability of every woman to be able to make a choice and to be able to have her healthcare needs met.']"
BUTTIGIEG,"[' And we’re seeing a rise in the deaths from despair. I believe only the president can build a sense of belonging and purpose for the entire country. The purpose of the presidency is not the glorification of the president, it is the unification of the American people. And I’m asking for your vote to be that president, when the dust clears over the rubble of our norms and institutions at the end of the Trump presidency, pick up the pieces and guide us toward a better future.']"
BUTTIGIEG,"[' We shouldn’t have to pay farmers to take the edge off of a trade war that shouldn’t have been started in the first place. I will support farmers, but not long ago I was in Boone, Iowa, a guy came up to me, he said, “I got my Trump bailout check, but I would have rather spent that money on conservation.” By the way, this isn’t even making farmers whole, if you’re in soy beans, for example, you’re getting killed, and it’s not just what this president’s done with the trade war; in a lot of parts of the country, the worst thing is these so-called small refinery waivers which are killing those who are involved in ethanol. Look, I don’t think this president cares one bit about farmers. He keeps asking them to take one for the team. But more and more, I’m talking to people in rural America who see that they’re not going to benefit from business as usual under this president.']"
YANG,"[' So to follow up on what Elizabeth said, why are we losing to the fossil fuel companies? Why are we losing to the gun lobby and the NRA? And the answer is this, we all know, everyone on the stage knows, that our government has been overrun by money and corporate interests. Now, everyone here has a plan to try and curb those corporate interests, but we have to face facts, money finds a way, money will find its way back in. So what is the answer? The answer is to wash the money out with people-powered money. My proposal is that we give every American a 100 democracy dollars that you can only give to candidates in causes that you like, this would wash out the lobbyists’ cash by a factor of eight to one, that is the only way we will win and as someone running for President, and I’ll tell you, there’s the people on one side and the money on the other, the only way for us to win is if we bring them together.']"
KLOBUCHAR,"[' We have a guy there that is literally running our country like a game show. He would rather lie than lead. I think we need something different. I am someone that tells the truth. I don’t make promises that I can’t keep. I have people’s back. And I believe that to win, you bring people with you, and that is how you govern as well. So you’re going to hear a lot of ideas up here. Some will be great, but if you see that some of them seem a little off-track, I’ve got a better way. If you feel stuck in the middle of the extremes in our politics and you are tired of the noise and the nonsense, you’ve got a home with me, because I don’t want to be the President for half of America, I want to be the President for all of America.']"
YANG,"[' If we do not hold him to account, if there is not justice, not only have we failed this moment, our Constitution and our country, but we have failed everyone who has sacrificed…']"
WARREN,"[' Yes, and I’ll tell you why. What we’re doing right now in Afghanistan is not helping the safety and security of the United States. It is not helping the safety and security of the world, it is not helping the safety and security of Afghanistan. We need to bring our troops home. And then, we need to make a big shift. We cannot ask our military to keep solving problems that cannot be solved militarily. We’re not going to bomb our way to a solution in Afghanistan. We need to treat the problem of terrorism as a worldwide problem. And that means we need to be working with all of our allies', ' Our European allies, our Canadian allies, our Asian allies, our allies in Africa and in South America. We need to work together to root out terrorism. It means using all of our tools. It means economic investment, it means expanding our diplomatic efforts instead of hollowing out the State Department and deliberately making it so we have no eyes and ears in many of these countries. We need a foreign policy that is about our security and about leading on our values.']"
WARREN,"[' So, let’s be clear about this. People will have access to all of their doctors, all of their nurses, their community hospitals, their rural hospitals. Doctors won’t have to hire people to fill out crazy forms. They won’t have to spend time on the phone arguing with insurance companies, people who have sick family members won’t have to get into these battles. What this is about is making sure that we have the most efficient way possible to pay for healthcare for everyone in this country. Insurance companies last year sucked $23 billion in profits out of the system. How did they make that money? Every one of those $23 billion was made by an insurance company saying no to your healthcare coverage.']"
WARREN,"[' We have to have an announced policy that is one the entire world can live with, we need to make that clear. We will respond if someone else does but not first.']"
BOOKER,"[' Well, first and foremost, I want to hit that point, because we know Donald Trump’s a racist, but there is no red badge of courage for calling him that. Racism exists. The question isn’t who isn’t racist, it’s who is and isn’t doing something about racism. And this is not just an issue that started yesterday, it’s not just an issue that we hear a president that can’t condemn white supremacy, we have systemic racism that is eroding our nation from healthcare to the criminal justice system. And it’s nice to go all the way back to slavery, but, dear God, we have a criminal justice system that is so racially biased, we have more African-Americans under criminal supervision today than all the slaves in 1850. We have to come at this issue attacking systemic racism, having the courage to call it out and having a plan to do something about it. If I am President of United States, we will create an office in the White House to deal with the problem of white supremacy and hate crimes, and we will make sure that systemic racism is dealt with in substantive plans, from criminal justice reform to the disparities in healthcare, to even one that we don’t talk about enough, which is the racism that we see in environmental injustice in communities of color all around this country.']"
WARREN,"[' For decades, we have had a trade policy that has been written by giant multinational corporations to help giant multinational corporations. They have no loyalty to America, they have no patriotism. If they can save a nickel by moving a job to Mexico, they’ll do it in a heartbeat. If they can continue a polluting plant by moving it to Vietnam, they’ll do it in a heartbeat. I have put out a new comprehensive plan that says we’re not gonna do it that way. We’re gonna negotiate our deals with unions at the table, with small businesses at the table, with small farmers at the table, with environmentalists at the table, with human rights activists at the table. And then we’re gonna use the fact that everybody in the world wants to get to America’s markets. They wanna sell to you.']"
WARREN,"[' I think that what we have to do is we have to be an America that is clear about what we wanna do with immigration. We need to expand legal immigration. We need to create a path for citizenship, not just for Dreamers, but for grandmas and for people who have been working here in the farms and for students who have overstayed their visas. We need to fix the crisis at the border. And a big part of how we do that is we do not play into Donald Trump’s hands. He wants to stir up the crisis of the border because that’s his overall message. It’s if there’s anything wrong in your life, blame them.']"
WARREN,"[' I want to see us expand legal immigration and create a pathway to citizenship for our dreamers, but also for their grandparents and for their cousins, for people who’ve overstayed student visas and for people who came here to work in the fields. I want to have a system that is a path to citizenship that is fair and achievable. Down at the border we’ve got to rework this entirely. A system right now that cannot tell the difference in the threat posed by a terrorist, a criminal and a 12-year-old girl is not a system that is keeping us safer and it is not serving our values.']"
YANG,"[' The truth is that what happened to the 4 million manufacturing workers here in Ohio and Michigan and Pennsylvania and Wisconsin and Iowa did not care about our political party. The fourth industrial revolution is now migrating from manufacturing workers to retail, call centers, transportation, as well as to white collar workers like attorneys, pharmacists and radiologists. It does not care about our party. Donald Trump had a set of solutions in 2016, what did he say? He said we’re going to build a wall, we’re going to turn the clock back, we’re going to bring the old jobs back. America, we have to do the opposite of all of these things, we have to turn the clock forward, we have to accelerate our economy and society as quickly as possible, we have to evolve in the way we think about ourselves and our work and our value. It is not left, it is not right, it is forward and that is where we must take the country in 2020.']"
BOOKER,"[' Because of a massive diminution. A lot of reasons, but there was a massive diminution in the African-American vote. We need to have someone that can inspire, as Kamala said, to inspire African-Americans to the polls in record numbers.']"
BUTTIGIEG,"[' And I believe we need to send somebody in who has a different kind of experience, the experience on the ground, solving problems, working side by side with neighbors on some of the toughest issues that come up in government, recognizing what is required of executive leadership, and bringing that to Washington so that Washington can start looking a little more like our best-run communities in the heartland before the other way around starts to happen.']"
KLOBUCHAR,"[' So I went to the legislature, our state legislature, not an elected official, a mom, and I advocated for one of the first laws in the country guaranteeing new moms and their babies a 48-hour hospital stay. And when they tried to delay the implementation of that law, I brought six pregnant friends to the conference committee, so they outnumbered the lobbyists two to one. And when they said, “When should it take place?” They all raised their hand, and said, “Now.” That is what motivated me to go into public service and when I got to that gridlock of Washington DC, I got to work and pass over 100 bills and I know a lot of my friends here are from the left, but remember, I am from the middle of the country. And I believe if we’re going to get things done that we have to have someone leading the ticket with grit. Someone’s going to not just change the policies. But change the tone in the country and someone who believes in America and believes it from their heart because of where they came from, that everyone should have that same opportunity.']"
KLOBUCHAR,"[' I would codify Roe v. Wade and make it the law of the land. But what I want to do right now is just say what if Donald Trump was standing up here on the debate stage with me? You know what I would say to him? I said, you knew, you said you wanted to do this in your race for president. You actually said that you wanted to put women in jail. Then you tried to dial it back and you said you wanted to put doctors in jail. That is exactly what the Alabama law is, it put doctors in jail for 99 years. You, Donald Trump, are not on the side of women. You are not on the side of people of this country when over 75% of people want to keep Roe v. Wade on the book, when over 90% of people want to make sure we have available contraception. You de-funded Planned Parenthood, I would fund it again.']"
CASTRO,"[' And thank you George Stephanopoulos, to Jorge, to Linsey and to David and to all of you all for tuning in tonight. In many ways I shouldn’t be here on this stage. Castro is my mother’s name and was my grandmother’s name before her. I grew up in a single parent household, on the west side of San Antonio, going to the public schools. Eventually my brother Joaquin and I became the first in our family to become professionals, and when I got home, I took a job at the biggest law firm in town. I was making $100,000 a year in the year 2000, a few months later, I got elected to the San Antonio City Council, and the City Council at the time was only paying $1,040 a year, so everybody had another job, and my job was at the law firm.']"
SANDERS,"[' We need a healthcare system that guarantees healthcare to all people, as every other major country does. Not a system which provides $100 billion a year in profit for the drug companies and the insurance companies. And to tell you how absurd the system is tonight on ABC, the healthcare industry will be advertising, telling you how bad Medicare for All is, because they want to protect their profits. That is absurd.']"
SANDERS,"[' I think that what we have got to do is bring this world together, bring it together on climate change, bring it together in fighting against terrorism, and make it clear that we, as a planet, as a global community, will work together to help countries around the world rebuild their struggling economies and do everything that we can to rid the world of terrorism. But dropping bombs on Afghanistan and Iraq was not the way to do it.']"
SANDERS,"[' Matter of fact, I do. But before I get into that, the major issue that we don’t talk about in Congress, we don’t talk about in the media, is the massive level of income and wealth inequality in America. You got three people who own more wealth than the bottom 90%. You have a top 1% that owns more wealth than the bottom 92%. 49% of all income goes to the top 1%. Companies like Amazon and billionaires out there do not pay one nickel in federal income tax. And we’ve got 500,000 people sleeping out on the street. What we need is a political revolution that tells these billionaires and corporate America that they are Americans, they’ll participate in our society, but they have got to start paying their fair share of taxes, period.']"
STEYER,"[' When you look at inequality in the United States of America, you have to start with housing. Where you put your head at night determines so many things about your life. It determines where your kids go to school, it determines the air you breathe, where you shop, how long it takes you to get to work. What we’ve seen in California is as a result of policy, we have millions too few housing units, and that affects everybody in California. It starts with a homeless crisis that goes all through the state, but it also includes skyrocketing rents that affect every single working person in the state of California.']"
BIDEN,"[' Well, they have to deal with the… Look, there is institutional segregation in this country. And from the time I got involved, I started dealing with that. Redlining banks, making sure that we are in a position where… Look, talk about education, I propose that what we take is those very poor schools, the title 1 schools. Triple the amount of money we spend from $15 to $45 billion a year, give every single teacher a raise, a equal raise, of getting out of $60,000 level. Number two, make sure that we bring in to help… The teachers deal with the problems that come from home, the problems that come from home. We have one school psychologist for every 1,500 kids in America today.']"
KLOBUCHAR,"[' Yes. What is broken is a political system that allows the NRA and other large, big money to come in and make things not happen when the majority of people are for it. The people are with us now. After Parkland, those students just didn’t march. They talked to their dads and their grandpas and the hunters in their family, and they said, “There must be a better way.” Then we elected people in the House of Representatives, and guess what? It changed. And they passed universal background checks. And now that bill is sitting on Mitch McConnell’s doorstep because of the money and the power of the NRA. As president, I will take them on.']"
KLOBUCHAR,"[' Everyone wants to get elected. But my point is this, I think, when we have a guy in the White House that has now told over 10,000 lies, that we better be very straightforward with the American people. And no, do I think that we are gonna end up voting for a plan that kicks half of America off of their current insurance in four years? No, I don’t think we’re gonna do that. I think there is a better way to get what we all wanna see which is lower costs for healthcare. Do I think that we’re gonna vote to give free college to the wealthiest kids? No, I don’t think we’re gonna do that. So that’s what I’m talking about. But what I don’t like about this argument right now, what I don’t like about it at all, is that we are more worried about winning an argument than winning an election.']"
BIDEN,"[' And it was later when we came into office, that Barack, the president turned to me and said, “Joe… ” when they said we got to plan to get out, he turned to the whole security, and said, “Joe will organize this. Get the troops home.” My son spent a year in Iraq, and I understand, and we were right to get the combat troops out. The big mistake that was made, which we predicted, was that you would not have a circumstance where the Shia and the Kurds would work together to keep ISIS from coming, from moving in.']"
STEYER,"[' I understand exactly what needs to be done here, which is we need to change policy and we need to apply resources here to make sure that we build literally millions of new units. But the other thing that’s going to be true about building these units is we’re going to have to build them in a way that’s sustainable. That, in fact, how we build units, where people live, has a dramatic impact on climate and on sustainability. So, we are going to have to direct dollars, we’re going to have to change policy and make sure that the localities and municipalities who’ve worked very hard to make sure that there are no new housing units built in their towns, that they have to change that and we’re going to have to force it and then we’re going to have to direct federal dollars to make sure that those units are affordable so that working people can live in places and not be spending 50% of their income on rent.']"
GABBARD,"[' Thank you. You know, really what this is about is getting to the heart of the fear that is well-founded. As people look to this automation revolution, they look to uncertainty. They don’t know how this is going to affect their jobs and their everyday lives. And I agree with my friend Andrew Yang. I think universal basic income is a good idea to help provide that security so that people can have the freedom to make the kinds of choices that they want to see. This has to do with bad trade deals that we’ve seen in the past, that have also driven fear towards people losing the way that they provide for their families. Really what we need to do is look at how we can best serve the interests of the American people. I do not believe a federal jobs guarantee is the way to do that. The value that someone feels in themselves and their own lives is not defined by the job that they have, but is intrinsic to who we all are as Americans, whatever we choose to do with our lives, and we can’t forget that.']"
SANDERS,"[' Yeah, okay. You’re looking, I believe, at the only member of Congress who not only voted against these disastrous trade agreements, NAFTA, PNTR with China, which cost us over 4 million jobs, but also help lead the effort against these agreements. Now, Elizabeth is absolutely right. If anybody here thinks that corporate America gives one damn about the average American worker, you’re mistaken. If they can save $0.05 cents by going to China, Mexico, or Vietnam, or any place else, that’s exactly what they will do. As president, let me tell you what I will do. These guys line up at the federal trough, they want military contracts, they want all kinds of contracts. Well, under my administration, you ain’t gonna get those contracts if you throw American workers out on the streets.']"
