label,Quotes
BUTTIGIEG,"[' Well, we need federal leadership to establish voting rights for the 21st century, because this affects every other issue that we care about. Now, the House of Representatives passed a pro-democracy, anti-corruption bill, which is one of many good bills to die in Mitch McConnell’s hands in the United States Senate. We know that with the White House in the right hands, we can make, for example, election days a federal holiday. We can use carrots and sticks to induce states to do the right thing with automatic voter registration, same-day voter registration, making it easier for people to vote, and, in particular, recognizing that we cannot allow the kind of racially motivated or partisan voter suppression, or gerrymandering, that often dictates the outcome of election before the voting even begins. Right now, we have politicians picking out their voters, rather than the other way around. That, compounding with what is being done to restrict the right to vote, means that our democracy is not worthy of the name.']"
BUTTIGIEG,"[' That’s right. When I proposed reforming the Supreme Court, some folks said that was too bold to even contemplate. Now, I’m not talking about packing the court just with people who agree with me, although I certainly will appoint people who share my values. For example, the idea that women’s reproductive freedom is an American right. What I’m talking about is reforms that will de-politicize the court. We can’t go on like this where every single time there is a vacancy, we have this apocalyptic ideological fire fight over what to do next. Now, one way to fix this would be to have a 15-member court where five of the members can only be appointed by unanimous agreement of the other 10. Smarter legal minds than mine are discussing this in the Yale Law Journal on how this could be done without a constitutional amendment. But the point is that not everybody arrives on a partisan basis. There are other reforms that we could consider, from term limits, don’t forget justices used to just retire like everybody else, to a rotation off the appellate bench.']"
KLOBUCHAR,"[' That’s not my record. We are here at a historically black college, and I think of an alum of that college, Barbara Jordan, and something that she once said. She said, “What the people want is simple. They want a country as good as its promise.” And that same could be said of the criminal justice system. So, when I was there, the way we handled these police shootings, I actually took a stand to make sure outside investigators handled them. I took on our major police chief in Minneapolis, but in the Prosecutor’s Office, they were handled with a grand jury. That’s how they were all handled across our state. I now believe it is better for accountability if the prosecutor handles them and makes those decisions herself. That aside, I am proud of the work our staff did, 400 people in our office. The cases that came to us, the African-American community that came to us, they said there was no justice for their little kids. There was a kid named Byron Phillips that was shot on his front porch. No one had bothered to figure out who did it.']"
YANG,"[' Everyone, we know we’re on the same team here, we know we’re on the same team, we all have a better vision for healthcare than our current president, and I believe we’re talking about this the wrong way. As someone who has run a business, I know that our current healthcare system makes it harder to hire people, makes it harder to give them benefits, and treat them as full-time employees. You instead pretend they’re contractors, it’s harder to change jobs, it’s certainly harder to start a business. The pitch we have to make to the American people is we will get the healthcare weight off of your backs and then unleash the hopes and dreams of the American people.']"
CASTRO,"[' And y’all saw a couple of days ago what happened to Atatiana Jefferson in Fort Worth, a cop showed up at 2', '00 in the morning at her house when she was playing video games with her nephew. He didn’t even announce himself, and within four seconds he shot her and killed her through her home window. She was in her own home. And so, I am not going to give these police officers another reason to go door-to-door in certain communities, because police violence is also gun violence. And we need to address that.']"
SANDERS,"[' They are people fleeing violence and I think the main thing that we’ve got to do, among many others, Beto made this point. We’ve gotta ask ourselves, “Why are people walking 2000 miles to a strange country where they don’t know the language?” So what we will do, the first week we are in the White House is bring the entire hemisphere together to talk about how we rebuild Honduras…']"
SANDERS,"[' I get a little bit tired, I must say, of people defending a system which is dysfunctional, which is cruel. 87 million uninsured, 30,000 people dying every single year, 500,000 people going bankrupt. For what reason? They came down with cancer. I will tell you what the issue is here. The issue is whether the Democratic Party has the guts to stand up to the healthcare industry, which made $100 billion in profit. Whether we have the guts to stand up to the corrupt price-fixing pharmaceutical industry, which is charging us the highest prices in the world for prescription drugs. And if we don’t have the guts to do that, if all we could do is take their money, we should be ashamed of ourselves.']"
BIDEN,"[' We’ve all been through that, in some form or another. And it just takes… It just, for me, the way I’ve dealt with it is finding purpose. And my purpose is do what I’ve always tried to do and stay engaged in public policy and… But there’s a lot of people went through a lot worse than I have, get up every single morning, put their feet one foot in front of another without the help I had, there are real heroes out there, some real heroes.']"
BIDEN,"[' Well, I think their vision is attracting a lot of people, and I think a lot of what they have to say is really important. But, you know, Elizabeth Warren said, we can’t be running any vague campaigns. We’ve got to level with people. We’ve got to level with people and tell them exactly what we’re going to do, how we’re going to get it done. And if you can get it done. I’m going to say something that is probably going to offend some people here, but, I’m the only one on this stage who’s gotten anything really big done. From the Violence Against Women Act, to making sure that we passed the Affordable Care Act, to be in a position where we, in fact, took out almost a $90 billion act that kept us from going into a depression.']"
GABBARD,"[' That our Democratic Party, unfortunately, is not the party that is of, by and for the people. It is a party that has been and continues to be influenced by the foreign policy establishment in Washington represented by Hillary Clinton and others’ foreign policy, by the military industrial complex and other greedy corporate interests. I’m running for president to be the Democratic nominee that rebuilds our Democratic Party, takes it out of their hands, and truly puts it in the hands of the people of this country. A party that actually hears the voices of Americans who are struggling all across this country, and puts it in the hands of veterans and fellow Americans who are calling for an end to this ongoing Bush-Clinton-Trump foreign policy doctrine of regime change wars, overthrowing dictators in other countries, needlessly sending my brothers and sisters in uniform into harm’s way to fight in wars that actually undermine our national security and have cost us thousands of American lives.']"
CASTRO,"[' Jorge, let me just say that I would… I was the first candidate in early April to put forward an immigration plan. You know why? Because I’m not afraid of Donald Trump on this issue, I’m not going to back-pedal, I’m not going to pretend like I don’t have my own vision for immigration, so we’re not going to give up DAnderson CooperA, we’re not going to give up protections for anybody. I believe that on January 20 of 2021, we’re going to have a Democratic President, we’re going to throw out Mitch McConnell and John Cornyn and have a Democratic Senate and a Democratic House, and we’re going to pass immigration reform within the first 100 days.']"
CASTRO,"[' Jorge, thank you very much for that question. And look, I agree that Barack Obama was very different from Donald Trump, Donald Trump has a dark heart when it comes to immigrants, he built his whole political career so far on scapegoating and fearmongering and otherizing migrants, and that’s very different from Barack Obama. But my problem with Joe Biden, and Cory pointed this out last time, is every time something good about Barack Obama comes up, he says, “Oh, I was there, I was there, I was there. That’s me too.” And then every time somebody questions part of the administration that we were both part of, he says, “Well, that was the President.” I mean, he wants to take credit for Obama’s work, but not have to answer any questions.']"
GABBARD,"[' But we must do more than just defeat Donald Trump, we need to deliver a win for the American people. We must stand united as Americans remembering that we are all brothers and sisters, that we are all connected. This is the kind of leadership that I seek to bring as president, inspired by the example of presidents like Abraham Lincoln, who talked about how we should have malice for none and charity for all. When I look out at our country, I don’t see deplorables, I see fellow Americans, people who I treat with respect even when we disagree and when we disagree strongly. I will work to restore a White House that represents light and compassion and respect for every American regardless of race, religion, orientation, gender or political affiliation. So I want to ask everyone to join me. Join me in bringing about this government of, by and for the people that serves all the people of this country, and visit my website, tulsi2020.com, for more information.']"
BIDEN,"[' Making us in a… Putting us in a position where I was able to end Roe v… Excuse me, able to end the issue of gun sales, in terms of assault weapons. And so the question is, who is best prepared? We all have good ideas. The question is, how… Who’s going to be able to get it done? How can you get it done? And I’m not suggesting they can’t, but I’m suggesting that that’s what we should look at. And part of that requires you not being vague. Tell people what it’s going to cost, how you’re going to do it, and why you’re going to do it. That’s the way to get it done. Presidents are supposed to be able to persuade.']"
BIDEN,"[' Yes, they have. I said from the beginning, that if in fact, Trump continued to stonewall what the Congress is entitled to know about his background, what he did, all the accusations in the Mueller Report. If they did that, they would have no choice, no choice but to begin an impeachment proceeding, which gives them more power to seek more information. This president, and I agree with Bernie, Bernie Sanders, is the most corrupt president in modern history, and I think all of our history. And the fact is that this president of the United States has gone so far as to say, since this latest event, that in fact he will not cooperate in any way at all. Will not list any witnesses, will not provide any information, will not do anything to cooperate with the impeachment. They have no choice but to move.']"
SANDERS,"[' Damn right, we will, and I’ll tell you why. If you look at what goes on in America today, we have an infrastructure which is collapsing. We could put 15 million people to work rebuilding our roads, our bridges, our water systems, our wastewater plants, airports, etcetera. Furthermore, and I hope we will discuss it at length tonight, this planet faces the greatest threat in its history from climate change. And the Green New Deal that I have advocated will create up to 20 million jobs as we move away from fossil fuel to energy efficiency and sustainable energy. We need workers to do childcare. We need workers, great teachers to come in to school systems, which don’t have the teachers that we need right now. We need more doctors. We need more dentists. We need more carpenters. We need more sheet metal workers. And when we talk about making public colleges and universities tuition-free and canceling student debt, we’re going to give those people the opportunity to get those good jobs.']"
SANDERS,"[' I think we have got to do… I think what I meant is what President Obama said, in that nobody up here is gonna tell you that we have a magical solution to the crisis. Now, I come from one of the most rural states in America. I have a D-minus voting record from the NRA. And as president, I suspect it will be an F record. What I believe we have got to do is have the guts to finally take on the NRA. You asked me about my record. Back in 1988, coming from a state that had no gun control, I called for the ban of the sale and distribution of assault weapons. I lost that election. I will do everything I can not only to take on the NRA, but to expand and create universal background checks, do away with the Straw Man provision, do away with the gun show loophole, and do away with the loopholes that now exist for gun manufacturers who are selling large amounts of weapons into communities that are going to gangs.']"
CASTRO,"[' Thank you very much for the question. I grew up in neighborhoods where it wasn’t uncommon to hear gunshots at night, and I can remember ducking into the back seat of a car when I was a freshman in high school across the street from my school, my public school, because folks were shooting at each other. In the neighborhoods, though, let me answer this question about voluntary versus mandatory. There are two problems I have with mandatory buybacks. Number one', ' Folks can’t define it, and if you’re not going to door door-to-door then it’s not really mandatory. But also in the places that I grew up in, we weren’t exactly looking for another reason for cops to come banging on the door.']"
YANG,"[' I am Asian, so I know a lot of doctors. And they tell me that they spend a lot of time on paperwork, avoiding being sued, and navigating the insurance bureaucracy. We have to change the incentive. So instead of revenue and activity, people are focused on our health in the healthcare system. And the Cleveland Clinic, where they’re paid not based upon how many procedures they prescribe. Shocker, they prescribe fewer procedures and patient health stays the same or improves. That is the pitch to the American people.']"
KLOBUCHAR,"[' When I came into that office, we worked with the community groups, we put up billboards, we found the shooter, and we put him in jail. We did the same for the killer of a little girl named Tyesha Edwards, who was doing her homework at her kitchen table and was shot through the window. What changes did we make? Go after white collar crimes in a big way, diversify the office in a big way, worked with the Innocence Project to make sure we do much better with eye witness ID. And as a senator and as your president, I will make sure that we don’t just do the first step act when it comes to criminal sentencing, that we move to the second step act, which means the 90% of people that are incarcerated in local and state jails, let’s reduce those sentences from non-violent offenders and let’s get them jobs and let them vote when they get out of prison.']"
BUTTIGIEG,"[' If I had a buck for every argument that I’ve witnessed like this I could pay for college for everybody. We need to move past what has been consuming this whole political space for as long as I’ve been alive. We’re being offered a false choice. I don’t agree with the Vice President that Trump is an aberration. I don’t agree that there’s any such thing as back to normal, because here in the industrial Midwest, definitely where I live, normal didn’t work. That’s part of how we got here. That’s part of how a guy like Donald Trump managed to get within cheating distance of the Oval Office in the first place. But I also don’t agree with Elizabeth Warren that the only way forward is infinite partisan combat. Yes, we have to fight. Absolutely, we have to fight for the big changes at hand, but it’s going to take more than fighting.']"
BUTTIGIEG,"[' And while these process issues are not always fashionable, we must act to reform our democracy itself, including when it comes to choosing our presidency.']"
YANG,"[' Of course, we have to look at the chain of events. How did we get here? The fact is we’re falling apart at home. So we voted in Donald Trump, and he’s now led us down this dangerous path with erratic and unreliable foreign policy. We have to let Russia know, look, we get it. We’ve tampered with other elections, you’ve tampered with our elections, and now it has to stop, and if it does not stop we will take this as an act of hostility against the American people. I believe most Americans would support me on this, but Russian hacking of our democracy is an illustration of the 21st century threats, artificial intelligence, cyber security, climate change, loose nuclear material, military drones, and non-state actors. These are the threats that are going to require our administration to catch up in terms of technology. We all know we are decades behind the curve on technology. We saw when Mark Zuckerberg testified in Congress the nature of the questioning. As commander-in-chief, I will help pull us forward.']"
OROURKE,"[' We’ll call his racism out for what it is, and also talk about its consequences. It doesn’t just offend our sensibilities to hear him say “Send her back” about a member of Congress, because she’s a woman color, because she’s a Muslim-American, doesn’t just offend our sensibilities when he calls Mexican immigrants “rapists and criminals,” or seeks to ban all Muslims from the shores of a country that’s comprised of people from the world over, from every tradition of faith. It is also changing this country. Hate crimes are on the rise, every single one over the last three years. On the day that he signed his executive order attempting to ban Muslim travel, the mosque in Victoria, Texas was burned to the ground. So we must not only stand up against Donald Trump and defeat him in this next election, but we must also ensure that we don’t just tolerate or respect our differences, but we embrace them. That’s what we’ve learned in El Paso, Texas, my hometown. One of the safest cities in the United States of America, not despite, but because it’s a city of immigrants and asylum seekers, and refugees. We will show that our diversity is our strength in my administration.']"
WARREN,"[' Yes. We need to work on every front on climate change. It is the threat to every living thing on this planet, and we are running out of time. Every time the scientists go back, they say we have less and less time than we thought we had, but that means we’ve got to use all the tools. One of the tools we need to use are our regulatory tools. I have proposed, following Governor Inslee, that we, by 2028, cut all carbon emissions from new buildings, by 2030, carbon emissions from cars, and by 2035, all carbon emissions from the manufacture of electricity. That alone, those three, will cut our emissions here in the United States by 70%. We can do this. We also need to help around the world to clean, but understand this one more time, why doesn’t it happen? As long as Washington is paying more attention to money than it is to our future, we can’t make the changes we need to make. We have to attack the corruption head-on so that we can save our planet.']"
WARREN,"[' From the time I was seven years old, I had a dream. I wanted to be a public school teacher, but my daddy ended up as a janitor and by the time I graduated from high school, my family didn’t have the money to send me off to college. My big chance, was what was then, a commuter college that cost $50 a semester. For me, what this election is all about, is opportunity. Every budget, every policy that we talk about, is about who’s going to get opportunity. Is it gonna go to the billionaires or is it gonna go to our kids? Right now for decades, we have had a government that has been on the side of the rich and the powerful. It has been on the side of the wealthy. And that means it has not been on the side of everyone else. Not on the side of people living on our Native American reservations, people living in inner cities, people living in small farms, and small communities across this country. How do we beat it? We beat it by being the party of big structural change. Give people a reason to show up and vote, and we beat it by building a grassroots movement across this country. Not showing up behind closed doors with millionaires, but actually building it person-by-person across this country. With small dollar donations, with volunteers, with people who show up and say, “I have a stake in this democracy” I will not only beat Donald Trump in 2020, I’ll start to make real change come 2021.']"
BOOKER,"[' The only reason that South Bend is growing right now after years of shrinking is immigration. It’s one of the reasons we acted, not waiting for Washington to create city-issued municipal IDs. So that people regardless of immigration status in our city had the opportunity to have the benefits of identification. We have an opportunity to actually get something done, but we cannot allow this to continue to be the same debate with the same arguments and the same clever lines, often among the same people since the last real reform happened in the 1980s. We have to actually engage the American majority around the opportunities for not just growth in small communities, but our values, values of welcome, values of faith that all argue, for us to manage this humanly and in a way that marries our values with our laws.']"
WARREN,"[' I mentioned earlier I’ve known what I wanted to be since second grade; I wanted to be a public school teacher. And I invested early, I used to line my dollies up and teach school. I had a reputation for being tough but fair. By the time I graduated from high school, my family didn’t have money for a college application, much less to send me off to four years at a university. And my story, like a lot of stories, has a lot of twists and turns. Got a scholarship, and then at 19, I got married, dropped out of school, took a minimum wage job, thought my dream was over. I got a chance down the road at the University of Houston. And I made it as a special needs teacher. I still remember that first year as a special needs teacher. I could tell you what those babies looked like. I had four-to-six-year-olds. But at the end of that first year, I was visibly pregnant.']"
WARREN,"[' And now the question is how best can we improve on it? And I believe the best way we can do that is we make sure that everybody gets covered by healthcare at the lowest possible cost. How do we pay for it? We pay for it, those at the very top, the richest individuals and the biggest corporations are going to pay more and middle class families are going to pay less. That’s how this is going to work.']"
YANG,"[' Elizabeth Warren, I’ve been talking to Americans around the country about automation, and they’re smart. They see what’s happening around them. Their main street stores are closing. They see a self-serve kiosk in every McDonald’s, every grocery store, every CVS. Driving a truck is the most common job in 29 states, including this one. Three-and-a-half million truck drivers in this country. And my friends in California are piloting self-driving trucks. What is that going to mean for the three-and-a-half million truckers or the 7 million Americans who work in truck stops, motels and diners that rely upon the truckers getting out and having a meal? Saying this is a rules problems is ignoring the reality that Americans see around us every single day.']"
YANG,"[' I want to propose a new world data organization, like a WTO for data, because right now, unfortunately, we’re living in a world where data is the new oil and we don’t have our arms around it. These are the ways that we’ll actually get Russia to the table and make it so that they have to join the international community and stop resisting appeals to the world order.']"
KLOBUCHAR,"[' I think simply because you have different ideas doesn’t mean you’re fighting for regular people. I wouldn’t even be up on this stage if it wasn’t for unions and the dignity of work. If my grandpa didn’t have unions protecting him in those mines, he wouldn’t have survived. If my mom didn’t have unions as a teacher, she wouldn’t have been able to make the wages she made when my parents got divorced. So just because we have different ideas and get to the same place in terms of beating Donald Trump and taking this on, we are in Ohio, we can win Ohio in the presidency, but only if we unite…']"
